{
  "format": "bhfile",
  "version": 1,
  "habits": [
    {
      "id": "H1",
      "name": "Smoking",
      "unit": "cigarettes"
    },
    {
      "id": "H2",
      "name": "Masturbation",
      "unit": "occurrences"
    },
    {
      "id": "H3",
      "name": "Alcohol",
      "unit": "ml"
    }
  ],
  "days": [
    {
      "date": "2026-10-20",
      "habits": {
        "H1": 5,
        "H2": 1,
        "H3": 120
      }
    },
    {
      "date": "2026-10-21",
      "habits": {
        "H1": 0,
        "H2": 0,
        "H3": 0
      }
    },
    {
      "date": "2026-10-22",
      "habits": {
        "H1": 0,
        "H2": 0,
        "H3": 0
      }
    },
    {
      "date": "2026-10-23",
      "habits": {
        "H1": 2,
        "H2": 0,
        "H3": 0
      }
    },
    {
      "date": "2026-10-24",
      "habits": {
        "H1": 0,
        "H2": 0,
        "H3": 0
      }
    },
    {
      "date": "2026-10-25",
      "habits": {
        "H1": 0,
        "H2": 0,
        "H3": 0
      }
    }
  ],
  "summary": {
    "totalDays": 6,
    "greenDays": 4,
    "maxStreak": 2,
    "habits": {
      "H1": {
        "total": 7
      },
      "H2": {
        "total": 1
      },
      "H3": {
        "total": 120
      }
    }
  }
}
